title,description,url,tags,thumbnail_url,published_time
How To Identify Trends in Markets (Never Guess Again),"Want to learn how to find trends in markets? Well, you made it to the right video. In this video, I explain three different strategies to ...",https://www.youtube.com/watch?v=21b5QF-b0rE,[],https://i.ytimg.com/vi/21b5QF-b0rE/hqdefault.jpg,2021-10-25T15:47:16Z
"This is a very bullish setup for bitcoin into the election, says VanEck&#39;s Matthew Sigel","Matthew Sigel, VanEck head of digital assets research, joins 'Squawk Box' to discuss the state of crypto, market trend outlook, ...",https://www.youtube.com/watch?v=QUJNIMh3sMA,['Bitcoin'],https://i.ytimg.com/vi/QUJNIMh3sMA/hqdefault.jpg,2024-10-28T13:12:07Z
How to Use AI to Predict Crypto Market Trends (And Avoid Losses),"Using AI to predict crypto market trends is now a game-changer! Learn about tools like CryptoHawk, Santiment, and CoinRule that ...",https://www.youtube.com/watch?v=aYbsJp2ZkVQ,[],https://i.ytimg.com/vi/aYbsJp2ZkVQ/hqdefault.jpg,2024-11-05T20:00:02Z
"How Trump&#39;s Victory is Shaping Currency, Crypto &amp; Stock Markets | Vantage with Palki Sharma","How Trump's Victory is Shaping Currency, Crypto & Stock Markets | Vantage with Palki Sharma Markets across the globe have ...",https://www.youtube.com/watch?v=KsKmIaBcmWI,[],https://i.ytimg.com/vi/KsKmIaBcmWI/hqdefault.jpg,2024-11-06T17:55:00Z
How To Predict Reversals,Bullish rejection blocks can be a great way to find the bottoms of moves and can be great areas where price will reverse!,https://www.youtube.com/watch?v=2A2CqCmDbl0,[],https://i.ytimg.com/vi/2A2CqCmDbl0/hqdefault.jpg,2023-04-19T15:34:37Z
How To BEST Read Cryptocurrency Charts,"It's important to know how to read cryptocurrency charts. Reading price charts is an essential skill in crypto trading, whether it's day ...",https://www.youtube.com/watch?v=hAb_OTm-mGc,[],https://i.ytimg.com/vi/hAb_OTm-mGc/hqdefault.jpg,2020-09-26T15:00:08Z
🤑 TIME To Make MILLIONS In CRYPTO MARKET BULLSEASON 2024-25 | #bitcoin Crosses $76K | #altcoins NEXT,crypto #cryptocurrency #altcoins #cryptoinvestment #cryptobullrun With US Elections over and Mr. Donald Trump as the New ...,https://www.youtube.com/watch?v=YWZZfT3mZ00,['Bitcoin'],https://i.ytimg.com/vi/YWZZfT3mZ00/hqdefault.jpg,2024-11-07T11:30:22Z
How To START Day Trading Crypto Trends In 2024 [BEST 100x Strategies],"In this video I'll share with you SIMPLE but effective Day Trading strategies to trade trends, Grow accounts, and help get to your ...",https://www.youtube.com/watch?v=mT2k3fKNcJU,[],https://i.ytimg.com/vi/mT2k3fKNcJU/hqdefault.jpg,2024-05-26T13:32:19Z
How to Trade Crypto Coins for Beginners,"Cryptocurrency Trading and Investing guide for beginners. In this video, we're going to give you a brief explanation of the crypto ...",https://www.youtube.com/watch?v=Pw_AJtjIfmI,[],https://i.ytimg.com/vi/Pw_AJtjIfmI/hqdefault.jpg,2024-04-21T10:48:50Z
"Elon Musk &quot;I love Dogecoin, but DON&#39;T buy it!&quot;","Elon Musk talks about SpaceX, Twitter, Presidential Candidates, AI, China, getting to mars, Succession, Tesla, OpenAI, ChatGPT, ...",https://www.youtube.com/watch?v=yp1Is6y9Te8,['Dogecoin'],https://i.ytimg.com/vi/yp1Is6y9Te8/hqdefault.jpg,2023-05-25T16:17:27Z
What Crypto to Buy? 🚀 Crypto Market Last Big Wave? 🌊  (Rolling the Dice on the Last Big Bull Run 🎲),"Ledger ▻ https://bit.ly/Ledger-x30 NEW!! Ledger Stax & Flex On Sale NOW!! ✔️ Buy, exchange, grow, manage your assets!",https://www.youtube.com/watch?v=x_VvCuc8M78,[],https://i.ytimg.com/vi/x_VvCuc8M78/hqdefault.jpg,2024-10-20T23:55:37Z
How To BEST Predict Crypto Prices and Recognize Trends,Today I will be teaching you about predicting crypto prices and finding future crypto trends. Correctly forecasting crypto prices ...,https://www.youtube.com/watch?v=w0bEbbyyzQU,[],https://i.ytimg.com/vi/w0bEbbyyzQU/hqdefault.jpg,2020-09-23T15:00:28Z
Technical Analysis: Everything YOU NEED TO KNOW!!,Get The Hottest Crypto Deals https://www.coinbureau.com/deals/ Insider Info in our Socials ...,https://www.youtube.com/watch?v=lW3eWIj3Q04,[],https://i.ytimg.com/vi/lW3eWIj3Q04/hqdefault.jpg,2020-11-14T21:32:53Z
Is Bitcoin Ready For Bull Market?!,"Anthony Pompliano joins CNBC to talk bitcoin, election year, 2020 historical trends, stablecoins, and Satoshi. Pomp writes a daily ...",https://www.youtube.com/watch?v=GAPCmrE2l7k,['Bitcoin'],https://i.ytimg.com/vi/GAPCmrE2l7k/hqdefault.jpg,2024-10-17T12:46:28Z
FOMC OUT🚨 Latest Crypto Market Analysis &amp; BTC Updates Today 📊,"FOMC OUT   Latest Crypto Market Analysis & BTC Updates Today Stay up-to-date with the latest crypto news today, featuring ...",https://www.youtube.com/watch?v=fRiuJ3OH5Vg,[],https://i.ytimg.com/vi/fRiuJ3OH5Vg/hqdefault.jpg,2024-11-07T19:36:37Z
IDENTIFY Trends in Markets with THIS! Free On-chain Indicators for Bitcoin,Do you struggle to catch up with the latest Bitcoin market trends? Check out these best free on-chain indicators to help you ...,https://www.youtube.com/watch?v=StxKobibNuc,['Bitcoin'],https://i.ytimg.com/vi/StxKobibNuc/hqdefault.jpg,2024-01-01T10:43:11Z
"Joe Rogan, Elon Musk, and Trump Talk about War Mongers","For anyone exploring the crypto space, there are several other creators you should check out. Coin Bureau offers in-depth ...",https://www.youtube.com/watch?v=yYQ-PKCpszY,[],https://i.ytimg.com/vi/yYQ-PKCpszY/hqdefault.jpg,2024-11-04T22:43:35Z
BIG CRASH ACTION 😮 Latest Crypto Market Analysis &amp; BTC News Updates,BIG CRASH ACTION Latest Crypto Market Analysis & BTC News Updates (Hindi-Urdu) Stay informed with the latest crypto ...,https://www.youtube.com/watch?v=Rba-BYydsJE,[],https://i.ytimg.com/vi/Rba-BYydsJE/hqdefault.jpg,2024-11-07T09:13:34Z
CRYPTO TRENDS FOR 2024 WILL MAKE PEOPLE TOO RICH (Watch ASAP),Activate Nord VPN for JUST $3 PER MONTH and get access to Threat Protection: https://nordvpn.com/ellio #nft #ethereum #defi ...,https://www.youtube.com/watch?v=8UujNJTb_kQ,['Ethereum'],https://i.ytimg.com/vi/8UujNJTb_kQ/hqdefault.jpg,2023-12-28T21:54:02Z
NEW TRADER PSYCHOLOGY  #tradingview | Stock | Market | crypto | Trading | #shorts,NEW TRADER PSYCHOLOGY #tradingview | Stock | Market | crypto | Trading | #shorts #youtubeshorts Telegram Channel ...,https://www.youtube.com/watch?v=0F2204ehuP0,[],https://i.ytimg.com/vi/0F2204ehuP0/hqdefault.jpg,2023-03-22T13:13:11Z
Bitcoin: US Election Predictions 🔮 Crypto Market Analysis 📊 (Your Crypto Questions Answered! 🌟) AMA!,"Ledger ▻ https://bit.ly/Ledger-x30 NEW!! Ledger Stax & Flex On Sale NOW!! ✔️ Buy, exchange, grow, manage your assets!",https://www.youtube.com/watch?v=6ON_9HxpMHc,['Bitcoin'],https://i.ytimg.com/vi/6ON_9HxpMHc/hqdefault.jpg,2024-08-03T12:36:55Z
Live Bitcoin &amp; Ethereum 15 Min Signals And Technical Analysis  ChartPrime,Welcome to the ChartPrime 24/7 trading livestream! This stream showcases the ChartPrime premium indicators live To learn ...,https://www.youtube.com/watch?v=k6L3z81iVI8,"['Bitcoin', 'Ethereum']",https://i.ytimg.com/vi/k6L3z81iVI8/hqdefault_live.jpg,2023-01-03T22:05:52Z
TRUMP BIG WIN 🚀 Latest Crypto Market Analysis &amp; BTC Updates Today 📊,"TRUMP BIG WIN Latest Crypto Market Analysis & BTC Updates Today Stay up-to-date with the latest crypto news today, ...",https://www.youtube.com/watch?v=erBdtnegIwE,[],https://i.ytimg.com/vi/erBdtnegIwE/hqdefault.jpg,2024-11-06T09:17:20Z
Elon and Joe Rogan talk Peanut The Squirrel | Trump,"For anyone exploring the crypto space, there are several other creators you should check out. Coin Bureau offers in-depth ...",https://www.youtube.com/watch?v=kU3wdWD0qpw,[],https://i.ytimg.com/vi/kU3wdWD0qpw/hqdefault.jpg,2024-11-04T22:46:19Z
Crypto Bull Runs 📈 Bear Traps 📉 &amp; Beyond! | Bitcoin Market Trends 📊 (Analysis &amp; Price Predictions 🌟),Tangem (III Pillars) ▻ https://bit.ly/Tangem-x4 Special “Crypto Casey” Signature Limited Edition!! ✔️ “III Pillars of ...,https://www.youtube.com/watch?v=vQOIHiRcySc,['Bitcoin'],https://i.ytimg.com/vi/vQOIHiRcySc/hqdefault.jpg,2024-07-23T16:02:39Z
#Cryptocurrency Fundamental Analysis | Which Coin to Buy? | Bitcoin Study | Financial Education,In this video you will learn how you can do the fundamental analysis of Cryptocurrencies. You will also get to know which coins to ...,https://www.youtube.com/watch?v=26pKp6dy9JA,['Bitcoin'],https://i.ytimg.com/vi/26pKp6dy9JA/hqdefault.jpg,2021-05-22T09:00:00Z
🚨 CRYPTO MARKET CRISIS Is This the END For 2024-25 BullRun | अब क्या होगा ALTSEASON का | CryptoCrash,crypto #cryptocurrency #altcoin #cryptoinvestment #cryptocrash #bitcoin With Crypto Market currently going down the pain of the ...,https://www.youtube.com/watch?v=_gNKuNQyltw,['Bitcoin'],https://i.ytimg.com/vi/_gNKuNQyltw/hqdefault.jpg,2024-11-03T13:30:21Z
Total Crypto Market Chart Reveals Shocking Truth,Total market cap of crypto shows something crazy! GET MY FREE NEWSLETTER https://cryptolark.co/WEALTH_MASTERY ...,https://www.youtube.com/watch?v=k3AQ2RdGzQg,[],https://i.ytimg.com/vi/k3AQ2RdGzQg/hqdefault.jpg,2024-08-14T15:00:50Z
Bitcoin in Bear Trap? 🐻🚀 Or Crypto Market Crash Soon? 🔮📉 (Understanding Crypto Market Trends! 📊🔍 ),LIMITED EDITION “III PILLARS” TANGEM!! Tangem (III Pillars) ▻ https://bit.ly/Tangem-x4 Special “Crypto Casey” ...,https://www.youtube.com/watch?v=rMAiysM37YI,['Bitcoin'],https://i.ytimg.com/vi/rMAiysM37YI/hqdefault.jpg,2024-07-14T16:35:18Z
How to Analyze Crypto Market for Trading,"For Personal Mentorship, Contact on Whatsapp - https://wa.me/03477707138?text= Bingx : https://bingx.com/invite/S9LAJ0 Join ...",https://www.youtube.com/watch?v=5E4UJlL7h6w,[],https://i.ytimg.com/vi/5E4UJlL7h6w/hqdefault.jpg,2024-09-27T10:15:00Z
What is On-chain Analysis? Track the Crypto Market Like a Pro | Blum Academy,"blum #blumacademy In today's video, we dive deep into on-chain data, one of the most powerful tools for analyzing the crypto ...",https://www.youtube.com/watch?v=GEWukHBJ1CE,[],https://i.ytimg.com/vi/GEWukHBJ1CE/hqdefault.jpg,2024-10-25T14:00:23Z
Top cryptos to hold become a millionaire in 2025 | Crypto book,Top cryptos to hold become a millionaire in 2025 | Crypto book #lunc #terralunaclassic #terraluna #luna #pinetwork ...,https://www.youtube.com/watch?v=AwmIYCHqczM,[],https://i.ytimg.com/vi/AwmIYCHqczM/hqdefault.jpg,2023-01-25T07:06:39Z
Top Crypto Market Trends &amp; Insights You Need to Know!,Stay Ahead with Market Trends & Insights! Discover key movements shaping the crypto world today. #CryptoTrends ...,https://www.youtube.com/watch?v=W4s_l1Kg5M4,[],https://i.ytimg.com/vi/W4s_l1Kg5M4/hqdefault.jpg,2024-10-23T11:58:25Z
Crypto Trading Masterclass 06 - Trendlines - How To Use Trendlines To Trade Crypto&#39;,"In this exclusive edition of Sheldon the Sniper's Crypto Trading Masterclass, he teaches you how to use trendlines to become a ...",https://www.youtube.com/watch?v=Uxllqa-2pAs,[],https://i.ytimg.com/vi/Uxllqa-2pAs/hqdefault.jpg,2021-12-21T09:30:04Z
Q2 Crypto Market Update!! You Need To See This Report!!,Get The Hottest Crypto Deals https://coinbureau.com/deals/ ♣️ Join The Coin Bureau Club https://hub.coinbureau.com/ ...,https://www.youtube.com/watch?v=ccvymFg5lY0,[],https://i.ytimg.com/vi/ccvymFg5lY0/hqdefault.jpg,2024-08-06T14:15:11Z
Why Ethereum Could Soar to $100K Soon! Crypto Trends Podcast,"In this episode, we discuss the urgent need for America to step up its game in the world of cryptocurrency and the potential of ...",https://www.youtube.com/watch?v=5CMMxgPQJ5c,['Ethereum'],https://i.ytimg.com/vi/5CMMxgPQJ5c/hqdefault.jpg,2024-09-26T19:25:20Z
🚀 Crypto Market Update: Unveiling Today&#39;s Top Trends and News! 📈,"Stay ahead in the crypto game with our latest market update! Discover the hottest trends, breaking news, and expert insights on ...",https://www.youtube.com/watch?v=aI7HFUwEVJA,[],https://i.ytimg.com/vi/aI7HFUwEVJA/hqdefault.jpg,2024-10-29T19:58:46Z
Frogs Daily News - October 30: Crypto Market Trends and Key Blockchain Updates,,https://www.youtube.com/watch?v=IWU0XcyOkNQ,[],https://i.ytimg.com/vi/IWU0XcyOkNQ/hqdefault.jpg,2024-10-30T03:57:41Z
Memefi Video Code today | HOW TO USE AI TO PREDICT CRYPTO MARKET TRENDS (AND AVOID LOSSES),Memefi Video Code today | HOW TO USE AI TO PREDICT CRYPTO MARKET TRENDS (AND AVOID LOSSES) HOW TO USE AI ...,https://www.youtube.com/watch?v=jHW5S7XFblI,[],https://i.ytimg.com/vi/jHW5S7XFblI/hqdefault.jpg,2024-11-05T20:06:04Z
"How to identify Crypto Trends like a Pro? Uptrend, Downtrend, Sideways Trends explained","Support & resistance levels can be identified easily with trend lines, which help crypto traders find the right buy, sell & trade ...",https://www.youtube.com/watch?v=hlFZ8Fga_Do,[],https://i.ytimg.com/vi/hlFZ8Fga_Do/hqdefault.jpg,2023-04-03T12:30:11Z
Making 8000$ in 1 hour trading Bitcoin #trading #crypto #binance #shorts #futures #livetrading,Our group https://t.me/Infinity_Crypto_Signals Making 8000$ in 1 hour trading Bitcoin #trading #crypto #binance #shorts ...,https://www.youtube.com/watch?v=4B6XS1RQVp8,['Bitcoin'],https://i.ytimg.com/vi/4B6XS1RQVp8/hqdefault.jpg,2023-03-27T18:01:07Z
ANDREW TATE SAYS THIS ABOUT CRYPTO FUTURE  #shorts,"shorts Andrew Tate talks about crypto - bitcoin, ethereum and the community scams that are happeing. Developers create ...",https://www.youtube.com/watch?v=mHwNoZ2C8wU,"['Bitcoin', 'Ethereum']",https://i.ytimg.com/vi/mHwNoZ2C8wU/hqdefault.jpg,2022-11-15T01:00:16Z
CRYPTO Market Bottom! (MAJOR Signals!),"In this video, I discuss numerous indicators signaling a potential bottom in the crypto market. We'll examine various perspectives, ...",https://www.youtube.com/watch?v=GNnVJx9sRoQ,[],https://i.ytimg.com/vi/GNnVJx9sRoQ/hqdefault.jpg,2024-07-15T01:41:13Z
Learn Crypto Trading | How to Trade in Bitcoin &amp; Crypto Derivatives Tutorial,Learn Step by Step Crypto Trading | Derivative Trading Explained 1. First Win 15 USDT in Bonus and Airdrop: ...,https://www.youtube.com/watch?v=bum9yg4gMyw,['Bitcoin'],https://i.ytimg.com/vi/bum9yg4gMyw/hqdefault.jpg,2023-05-11T10:30:09Z
How to Use AI to Predict Crypto Market Trends (And Avoid Losses) | Memefi Youtube Video Code,How to Use AI to Predict Crypto Market Trends (And Avoid Losses) | Memefi Youtube Video Code Memefi New Youtube Video ...,https://www.youtube.com/watch?v=N7Kglmr4i1U,[],https://i.ytimg.com/vi/N7Kglmr4i1U/hqdefault.jpg,2024-11-05T20:03:04Z
"Crypto Market on Edge: Durov’s Arrest, Market Sentiment, and Altcoin Trends (+ Big Giveaway)","In This Video: In today's episode, we're breaking down some major developments that are making waves in the crypto world.",https://www.youtube.com/watch?v=lDVz-NVT7L0,[],https://i.ytimg.com/vi/lDVz-NVT7L0/hqdefault.jpg,2024-09-01T08:00:33Z
7 Years of Crypto Trading Knowledge in 50 Minutes,"I've been trading Crypto and Investing in Crypto for the last 7 years. And I've bought it all. From Bitcoin to Ethereum, popular ...",https://www.youtube.com/watch?v=QKdbH4333wc,"['Bitcoin', 'Ethereum']",https://i.ytimg.com/vi/QKdbH4333wc/hqdefault.jpg,2024-10-22T12:30:19Z
CRYPTO MARKET CRASH - Shocking Bitcoin &amp; Ethereum Price Prediction | Bitcoin &amp; Ethereum Trends !,CRYPTO MARKET CRASH - Shocking Bitcoin & Ethereum Price Prediction | Bitcoin & Ethereum Trends ! Premium on Telegram ...,https://www.youtube.com/watch?v=oCd19gxgzF8,"['Bitcoin', 'Ethereum']",https://i.ytimg.com/vi/oCd19gxgzF8/hqdefault.jpg,2024-11-02T15:53:01Z
